"Story","Title","Result","Date","Stability","Duration (s)"
"User login","Successful login with valid credentials","SUCCESS","2026-06-10T07:36:45.1371632-05:00[America/Bogota]","0.0","6.97"
"Register expense","Successful expense registration with valid data","SUCCESS","2026-06-10T08:02:04.6484184-05:00[America/Bogota]","0.0","15.68"
"Register expense","Failed expense registration due to empty amount","SUCCESS","2026-06-10T08:02:47.5463242-05:00[America/Bogota]","0.0","2.41"
"Register expense","Failed expense registration due to no category selected","SUCCESS","2026-06-10T08:03:06.7796837-05:00[America/Bogota]","0.0","2.3"
"Register income","Successful income registration with valid data","SUCCESS","2026-06-10T07:50:53.6818655-05:00[America/Bogota]","0.0","11.41"
"Register income","Failed income registration due to empty amount","SUCCESS","2026-06-10T07:51:27.9112183-05:00[America/Bogota]","0.0","2.42"
"Register income","Failed income registration due to no category selected","SUCCESS","2026-06-10T07:51:46.1055712-05:00[America/Bogota]","0.0","2.3"
"View transaction history","Successful history query with transactions","SUCCESS","2026-06-10T07:41:27.0545212-05:00[America/Bogota]","0.0","6.26"
