"Story","Title","Result","Date","Stability","Duration (s)"
"User login","Successful login with valid credentials","ERROR","2026-06-10T08:22:49.2056352-05:00[America/Bogota]","0.0","6.64"
"User login","Failed login due to incorrect credentials","ERROR","2026-06-10T08:23:20.9500492-05:00[America/Bogota]","0.0","0.33"
"User login","Failed login due to empty fields","ERROR","2026-06-10T08:23:36.5727698-05:00[America/Bogota]","0.0","0.28"
"User login","Failed login due to unregistered user","ERROR","2026-06-10T08:23:46.1760798-05:00[America/Bogota]","0.0","0.25"
"Register user","Successful user registration","ERROR","2026-06-10T08:24:02.8848862-05:00[America/Bogota]","0.0","3.8"
"Register user","Failed registration due to already registered email","ERROR","2026-06-10T08:24:29.3347522-05:00[America/Bogota]","0.0","0.27"
